<?xml version="1.0" encoding="UTF-8"?>
<!DOCTYPE catalog [
	<!ENTITY favoriteAuthor SYSTEM "김연수">
]>
<catalog xmlns:xsi="http://www.dongduk.ac.kr/bookML/2.0" 
			xmlns="http://www.w3.org/2001/XMLSchema-instance" 
			xsi:schemaLocation="http://www.dongduk.ac.kr/bookML/2.0 BooML.xsd ">
  <bookList>
    <book isbn="895468000-3">
      <title>이토록 평범한 미래</title>
      <author>&favoriteAuthor;</author>
      <translator>문학동네</translator>
      <publishDate day="07" month="10" year="2022"/>
      <revisionDate day="15" month="11" year="2023"/>
      <price currency="won">
        <listPrice>14000</listPrice>
        <salesPrice DiscountRate="10">12600</salesPrice>
      </price>
      <pages>276</pages>
      <rating>9.4</rating>
      <category>c101-1-1</category>
      <coverImage src="http://image.yes24.com/goods/113737429/XL" type="jpeg"/>
      <description>김연수는 9년 만의 신작 소설집. 종말 이후의 사라에 대한 여덟 편의 이야기. 작가가 
      최근 2~3년간 집중적으로 단편 작업에 매진한 끝에 선보이는 소설집으로, '시간'을 인식하는 김연수의 변화된 
      시각을 확인할 수 있게 한다...</description>
      <review>"우리가 달까지 갈 수는 없지만 갈 수 있다는 듯이 걸어갈 수는 있다. 달이 어디에 있
      는지 찾을 수만 있다면. 마찬가지로 우리는 달까지 걸어가는 것처럼 살아갈 수 있다. 희망의 방향만 찾을 수
      있다면"(-&lt;진주의 결말&gt; 중에서)...</review>
      <review>...</review>
    </book>
    <book isbn="978-893497246-4" xsi:type="eBookType">
    	<title>사피엔스</title>
    	<originalTitle>Sapiens: A Brief History of Humankind &amp; Earth</originalTitle>
      	<author>유발 하라리</author>
      	<translator>조현욱</translator>
      	<publisher>김영사</publisher>
      	<publishDate day="19" month="05" year="2014"/>
      	<price>
	        <listPrice>12000</listPrice>
	        <salesPrice DiscountRate="20">9600</salesPrice>
	    </price>
	    <pages>241</pages>
	    <rating>9.2</rating>
	    <category>c102-1</category>
	    <category>c103-2</category>
	    <description>변방의 유인원 호모 사피엔스는 어떻게 세상의 지배자가 되었는가? 수렵채집을 하
      던 우리 조상들은 어떻게 한 곳에 모여 도시와 왕국을 건설하였는가? 인간은 왜 지구 역사상 가장 치명적인
      동물이 되었는가? 과학은 모든 종교의 미래인가?...</description>
      <format value="EPUB"/>
      <size unit="MB">26.60</size>
      <period>30</period>
    </book>
    <book isbn="978-890128069-1" xsi:type="newEBookType">
    	<title>생각 중독: 불안과 후회를 끊어내고 오늘을 사는 법</title>
		<originalTitle>Stop Overthinking</originalTitle>
		<author>닉 트렌턴</author>
      	<publishDate day="29" month="02" year="2024"/>
      	<category>c102-2</category>
      <format value="pdf"/>
      <size unit="MB">83.88</size>
      <period>20</period>
    </book>
  </bookList>
  <bookCategory>
    <category cid="c101" name="문학">
      <category cid="c101-1" name="소설"/>
      <category cid="c101-1-1" name="한국소설"></category>
      <category cid="c101-1-2" name="영미소설"></category>
    </category>
  </bookCategory>
</catalog>
